{
  "schema_version": "uaa-control-center-operational-maturity.v1",
  "status": "active operational maturity manifest",
  "baseline": "v0.103.0 / 0.103.0",
  "ladder_doc_ref": "docs/control_center/OPERATIONALIZATION_LADDER.md",
  "verifier_ref": "scripts/verify_operational_maturity.py",
  "modules": [
    {
      "module_id": "action_inbox",
      "role": "operator_module",
      "primary_surface": "Actions",
      "current_rank": 3,
      "current_rank_label": "decision_receipts",
      "honest_status": "decision_receipts_with_one_rank5_local_task_lane",
      "next_target_rank": 5,
      "smallest_next_operational_action": "local_task_create",
      "backend_routes": [
        "GET /control-center/actions/inbox",
        "GET /control-center/actions/{action_id}/receipt",
        "POST /control-center/actions/{action_id}/approve",
        "POST /control-center/actions/{action_id}/edit",
        "POST /control-center/actions/{action_id}/reject",
        "POST /control-center/actions/{action_id}/defer",
        "POST /control-center/actions/{action_id}/local-task/commit"
      ],
      "cli_or_script_refs": ["scripts/dev/uaa_founder_loop.py commit-local-task"],
      "receipt_refs": [
        "receipt:founder-loop-action:*",
        "receipt:founder-loop-local-task:*"
      ],
      "evidence_refs": [
        "evidence-ref:founder-loop:action-inbox",
        "evidence-ref:founder-loop:local-task-commit"
      ],
      "test_refs": [
        "tests/test_founder_loop_storage.py",
        "tests/test_control_center_api_routes.py",
        "apps/control-center/src/App.test.tsx"
      ],
      "verifier_refs": [
        "scripts/verify_fcc_v1_002_action_inbox_state_machine.py",
        "scripts/verify_operational_maturity.py"
      ],
      "route_metadata_refs": [
        "src/ultimate_ai_agent/api/manifest.py",
        "docs/control_center/route_status_manifest.json"
      ],
      "blocked_authorities": [
        "connector_write",
        "shell_subprocess_execution",
        "model_provider_authority",
        "memory_write",
        "context_injection",
        "external_side_effect",
        "production_authority",
        "broad_autonomy"
      ],
      "missing_contracts": [
        "generic_action_execution",
        "connector_write_execution",
        "rollback_execution"
      ],
      "backend_owned_receipts": true,
      "exact_scope_required": true,
      "idempotency_required": true,
      "rollback_or_safe_disable_required": true,
      "real_local_mutation": false,
      "durable_receipt": true,
      "evidence_timeline_event": true,
      "graduated_lanes": [
        {
          "lane_id": "local_task_create",
          "rank": 5,
          "honest_status": "local_execution_receipt_evidence",
          "smallest_operational_action": "Commit one approved local Action Inbox item into local task state.",
          "backend_routes": [
            "POST /control-center/actions/{action_id}/local-task/commit"
          ],
          "receipt_refs": ["receipt:founder-loop-local-task:*"],
          "evidence_refs": ["evidence-event-type:local_task_created"],
          "blocked_authorities": [
            "connector_write",
            "shell_subprocess_execution",
            "model_provider_authority",
            "memory_write",
            "context_injection",
            "external_side_effect",
            "production_authority"
          ],
          "real_local_mutation": true,
          "durable_receipt": true,
          "evidence_timeline_event": true,
          "cli_parity_ref": "scripts/dev/uaa_founder_loop.py commit-local-task",
          "focused_test_refs": [
            "tests/test_founder_loop_storage.py::test_action_inbox_local_task_commit_requires_exact_approval_and_records_evidence",
            "tests/test_control_center_api_routes.py::test_control_center_action_local_task_commit_requires_exact_approval_and_receipts"
          ]
        }
      ]
    },
    {
      "module_id": "files_patch_workbench",
      "role": "operator_module",
      "primary_surface": "Files",
      "current_rank": 2,
      "current_rank_label": "proposal_review",
      "honest_status": "proposal_review_apply_blocked",
      "next_target_rank": 4,
      "smallest_next_operational_action": "M173 patch apply contract",
      "backend_routes": [
        "POST /files/write/propose",
        "POST /files/diff/preview"
      ],
      "cli_or_script_refs": [],
      "receipt_refs": [],
      "evidence_refs": ["evidence-ref:governed-code-workbench"],
      "test_refs": ["tests/test_control_center_api_routes.py"],
      "verifier_refs": ["scripts/verify_control_center_frontend.py"],
      "route_metadata_refs": ["docs/control_center/route_status_manifest.json"],
      "blocked_authorities": ["code_apply_execution", "unrestricted_shell", "production_authority"],
      "missing_contracts": ["atomic_apply", "rollback_receipt", "secret_like_diff_blocking"],
      "backend_owned_receipts": false,
      "exact_scope_required": true,
      "idempotency_required": true,
      "rollback_or_safe_disable_required": true,
      "real_local_mutation": false,
      "durable_receipt": false,
      "evidence_timeline_event": false,
      "graduated_lanes": []
    },
    {
      "module_id": "memory",
      "role": "operator_module",
      "primary_surface": "Memory",
      "current_rank": 3,
      "current_rank_label": "decision_receipts",
      "honest_status": "review_decisions_and_internal_action_proposals_execution_blocked",
      "next_target_rank": 4,
      "smallest_next_operational_action": "narrow execution-hook contract only",
      "backend_routes": [
        "GET /control-center/memory/review",
        "POST /control-center/memory/review/{candidate_ref}/accept",
        "POST /control-center/memory/review/{candidate_ref}/correct",
        "POST /control-center/memory/review/{candidate_ref}/reject",
        "POST /control-center/memory/context-packs/{context_pack_ref}/action-proposal"
      ],
      "cli_or_script_refs": [],
      "receipt_refs": ["receipt:memory-review:*"],
      "evidence_refs": ["evidence-ref:founder-loop:memory-review-decision"],
      "test_refs": ["tests/test_fcc_v1_005_memory_review_decisions.py"],
      "verifier_refs": ["scripts/verify_fcc_v1_005_memory_review_decisions.py"],
      "route_metadata_refs": ["src/ultimate_ai_agent/api/manifest.py"],
      "blocked_authorities": ["automatic_memory_truth", "context_injection", "connector_write", "action_execution"],
      "missing_contracts": ["memory_write_policy_binding", "retention_delete_export_execution", "phase6_execution_hooks"],
      "backend_owned_receipts": true,
      "exact_scope_required": true,
      "idempotency_required": true,
      "rollback_or_safe_disable_required": true,
      "real_local_mutation": false,
      "durable_receipt": true,
      "evidence_timeline_event": true,
      "graduated_lanes": []
    },
    {
      "module_id": "chat_plans",
      "role": "operator_module",
      "primary_surface": "Chat / Plans",
      "current_rank": 3,
      "current_rank_label": "decision_receipts",
      "honest_status": "durable_receipts_and_handoffs_no_execution",
      "next_target_rank": 4,
      "smallest_next_operational_action": "handoff-to-approved-local-action only",
      "backend_routes": [
        "POST /control-center/chat/turns",
        "POST /control-center/chat/turns/{turn_ref}/handoff",
        "GET /task-decomposition/approvals"
      ],
      "cli_or_script_refs": [],
      "receipt_refs": ["receipt:chat-turn:*", "receipt:chat-handoff:*"],
      "evidence_refs": ["evidence-ref:founder-loop:chat-turn-receipt"],
      "test_refs": ["tests/test_fcc_v1_004_chat_durable_receipt_handoff.py"],
      "verifier_refs": ["scripts/verify_fcc_v1_004_chat_durable_receipt_handoff.py"],
      "route_metadata_refs": ["src/ultimate_ai_agent/api/manifest.py"],
      "blocked_authorities": ["model_output_authority", "handoff_execution", "memory_write", "action_execution"],
      "missing_contracts": ["approved_local_action_handoff_execution_contract"],
      "backend_owned_receipts": true,
      "exact_scope_required": true,
      "idempotency_required": true,
      "rollback_or_safe_disable_required": true,
      "real_local_mutation": false,
      "durable_receipt": true,
      "evidence_timeline_event": true,
      "graduated_lanes": []
    },
    {
      "module_id": "evidence",
      "role": "support",
      "primary_surface": "Evidence",
      "current_rank": 5,
      "current_rank_label": "local_execution_receipt_evidence",
      "honest_status": "support_indexes_receipt_backed_events",
      "next_target_rank": 6,
      "smallest_next_operational_action": "rollback trace binding",
      "backend_routes": ["GET /control-center/evidence/timeline"],
      "cli_or_script_refs": ["scripts/dev/uaa_founder_loop.py inspect"],
      "receipt_refs": ["receipt:founder-loop-action:*", "receipt:founder-loop-local-task:*"],
      "evidence_refs": ["evidence-event-type:local_task_created"],
      "test_refs": ["tests/test_fcc_v1_006_evidence_timeline_productization.py"],
      "verifier_refs": ["scripts/verify_fcc_v1_006_evidence_timeline_productization.py"],
      "route_metadata_refs": ["docs/control_center/route_status_manifest.json"],
      "blocked_authorities": ["approval_authority", "rollback_execution", "action_execution", "production_authority"],
      "missing_contracts": ["rollback_status_route", "durable_trace_binding"],
      "backend_owned_receipts": true,
      "exact_scope_required": true,
      "idempotency_required": true,
      "rollback_or_safe_disable_required": true,
      "real_local_mutation": false,
      "durable_receipt": true,
      "evidence_timeline_event": true,
      "graduated_lanes": []
    },
    {
      "module_id": "local_models",
      "role": "operator_module",
      "primary_surface": "Models",
      "current_rank": 2,
      "current_rank_label": "proposal_review",